{
	"id": "507f1f77bcf86cd799439011",
	"client_name": "MSN",
	"client_domain": "msn.ca",
	"client_code": "MSNC",
	"internal": false,
	"api_key": "786786jhjg3h23g23ghg77",
	"status": "deleted",
	"licenses": [
		"786786jhjg3h23g23ghg77",
		"987897897897b98fdsfd87",
		"4234234kjlk3j4234jhjh0"
	]
}
