{
	"id": "507f1f77bcf86cd799439011",
	"client_name": "Windsor Star",
	"client_domain": "windsorstar.com",
	"client_code": "WIST",
	"internal": true,
	"api_key": "786786jhjg3h23g23ghg77",
	"status": "active",
	"licenses": [
		"786786jhjg3h23g23ghg77",
		"987897897897b98fdsfd87",
		"4234234kjlk3j4234jhjh0"
	]
}
